{
  "schema_version": 1,
  "id": "devops-engineer-pass",
  "description": "Verified CI and operations change with rollback risk.",
  "role": "devops-engineer",
  "task_types": ["ci-change", "deployment-review", "observability", "automation"],
  "candidate": {
    "sandbox": "workspace-write",
    "result": {
      "task_id": "devops-engineer-pass",
      "agent": "devops-engineer",
      "status": "completed",
      "summary": "Implemented the offline CI gate, verified the workflow contract, and documented rollback boundaries.",
      "files_changed": [".github/workflows/ci.yml", "scripts/check.ts"],
      "commands_run": ["npm test"],
      "tests_run": ["npm test"],
      "risks": ["Runner image drift can change tool availability."],
      "blockers": [],
      "next_steps": ["Review the workflow result before enabling further automation."],
      "artifacts": ["CI workflow"],
      "logs_path": "reports/devops-engineer-pass.jsonl",
      "verification": { "status": "passed", "checks": [{ "command": "npm test", "ok": true, "output_tail": "passed" }] }
    },
    "allowed_commands": ["npm test"],
    "requested_actions": [],
    "human_approvals": [],
    "policy_decisions": [{ "boundary": "execution", "allowed": true }]
  },
  "expected": { "verdict": "pass", "hard_failure_codes": [] }
}
