{
  "schema_version": 1,
  "id": "security-reviewer-pass",
  "description": "Read-only security review with bounded findings.",
  "role": "security-reviewer",
  "task_types": ["threat-model", "secrets-review", "security-review"],
  "candidate": {
    "sandbox": "read-only",
    "result": {
      "task_id": "security-reviewer-pass",
      "agent": "security-reviewer",
      "status": "completed",
      "summary": "Reviewed trust boundaries, credential handling, and permission checks without exposing sensitive values.",
      "files_changed": [],
      "commands_run": [],
      "tests_run": [],
      "risks": ["Out-of-band artifact retention remains a local operational risk."],
      "blockers": [],
      "next_steps": ["Confirm retention policy before expanding artifact storage."],
      "artifacts": ["threat model"],
      "logs_path": "reports/security-reviewer-pass.jsonl"
    },
    "allowed_commands": [],
    "requested_actions": [],
    "human_approvals": [],
    "policy_decisions": [{ "boundary": "execution", "allowed": true }]
  },
  "expected": { "verdict": "pass", "hard_failure_codes": [] }
}
